{
  "producer": "claude-code",
  "variant": "A",
  "wire": "crypto",
  "run_id": "claude-code-2026-06-22T191543Z",
  "generated_at": "2026-06-22T19:15:43Z",
  "opportunities": [
    {
      "name": "Stellar Community Fund \u2014 SCF #45 (Build Award)",
      "source_url": "https://communityfund.stellar.org/awards",
      "wire": "crypto",
      "amount": "up to $150,000 in XLM",
      "deadline": "2026-07-26",
      "summary": "Apply to SCF #45 Build Award for up to $150,000 in XLM to take a validated Stellar/Soroban project from concept to launch; the submission round is open now with a July 26, 2026 deadline.",
      "classification": "GRANT",
      "fit_score": 85,
      "fit_reason": "fresh open round with concrete amount and future deadline",
      "evidence": [
        "https://communityfund.stellar.org/awards"
      ],
      "discovered_via": "web_search"
    },
    {
      "name": "Filecoin ProPGF Batch 3",
      "source_url": "https://filpgf.io/",
      "wire": "crypto",
      "amount": "up to $4M total (ProPGF program); amount per award is RFP-dependent",
      "deadline": "unknown",
      "summary": "Respond to Filecoin ProPGF Batch 3 RFPs published the week of June 1, 2026, funding core infrastructure maintenance and pod-supporting work; the ProPGF program carries up to $4M in total funding.",
      "classification": "GRANT",
      "fit_score": 80,
      "fit_reason": "RFPs published ~3 weeks ago \u2014 very fresh 2026 round on a trusted domain",
      "evidence": [
        "https://filpgf.io/"
      ],
      "discovered_via": "web_search"
    },
    {
      "name": "Avalanche Foundation \u2014 Network Economics Research Grants",
      "source_url": "https://www.avax.network/about/blog/research-grants-avalanche-network-economics",
      "wire": "crypto",
      "amount": "up to $50,000",
      "deadline": "rolling",
      "summary": "Apply for up to $50,000 in Avalanche Foundation research grants covering cryptoasset pricing/valuation and validator economics/network security; the canonical page confirms applications are open on a rolling basis with earlier submissions encouraged.",
      "classification": "GRANT",
      "fit_score": 66,
      "fit_reason": "recently announced research call, confirmed open at source",
      "evidence": [
        "https://www.avax.network/about/blog/research-grants-avalanche-network-economics"
      ],
      "discovered_via": "web_search"
    },
    {
      "name": "Sui Foundation Grants & RFP Program",
      "source_url": "https://www.sui.io/programs-funding",
      "wire": "crypto",
      "amount": "Academic Research Awards $25,000; DeFi Moonshots up to $500,000 in liquidity incentives; RFPs amount-dependent (program backed by a $50M commitment)",
      "deadline": "rolling",
      "summary": "Apply to Sui Foundation's 2026 funding stack \u2014 rolling and flash RFPs via the Sui Grants Hub, $25,000 academic research awards, and DeFi Moonshots offering up to $500,000 in liquidity incentives \u2014 under a $50M ecosystem commitment announced February 2026.",
      "classification": "GRANT",
      "fit_score": 58,
      "fit_reason": "major 2026 program with active rolling RFPs, slightly older than 60 days",
      "evidence": [
        "https://www.sui.io/programs-funding"
      ],
      "discovered_via": "web_search"
    },
    {
      "name": "Circle Developer Grants",
      "source_url": "https://www.circle.com/grant",
      "wire": "crypto",
      "amount": "not specified",
      "deadline": "rolling",
      "summary": "Apply to Circle Developer Grants, which the page confirms is actively accepting applications for its first 2026 cohort to fund developers building with USDC and Circle infrastructure; specific amounts and deadline are not published on the page.",
      "classification": "GRANT",
      "fit_score": 52,
      "fit_reason": "confirmed open 2026 cohort, but amount/deadline undisclosed",
      "evidence": [
        "https://www.circle.com/grant"
      ],
      "discovered_via": "web_search"
    }
  ],
  "rejected": [
    {
      "name": "Solana Incubator Cohort 5",
      "source_url": "https://incubator.solanalabs.com/",
      "classification": "EXPIRED",
      "reason": "Canonical page shows a June 5 (and search-reported June 10) 2026 deadline, both now past; also an accelerator with no disclosed grant/funding amount (relocation stipend only)."
    },
    {
      "name": "Cardano Project Catalyst Fund14",
      "source_url": "https://forum.cardano.org/t/catalyst-fund14-is-open-submit-your-ideas-by-aug-18/147903",
      "classification": "EXPIRED",
      "reason": "Fund14 idea submission closed Aug 18, 2025; no Fund15 round verified as open."
    },
    {
      "name": "Gitcoin Grants 24 (GG24)",
      "source_url": "https://gitcoin.co/blog/announcing-gitcoin-grants-24",
      "classification": "EXPIRED",
      "reason": "Round concluded in late 2025; no longer accepting applications."
    },
    {
      "name": "Ethereum Foundation PhD Fellowship 2026",
      "source_url": "https://esp.ethereum.foundation/rounds/phdfp26",
      "classification": "EXPIRED",
      "reason": "Application deadline was 23:59 AoE April 22, 2026 \u2014 past."
    },
    {
      "name": "Ethereum Foundation Academic Grants Round",
      "source_url": "https://esp.ethereum.foundation/academic-grants",
      "classification": "EXPIRED",
      "reason": "Most recent academic round deadline was March 24, 2025; no open 2026 round confirmed."
    },
    {
      "name": "Arbitrum Trailblazer 2.0",
      "source_url": "https://arbitrum.foundation/grants",
      "classification": "EXPIRED",
      "reason": "Canonical grants page marks Trailblazer 2.0 as 'Program Complete' \u2014 no longer accepting applications."
    },
    {
      "name": "Optimism Retro Funding / RetroPGF",
      "source_url": "https://atlas.optimism.io/",
      "classification": "NOISE",
      "reason": "Retroactive program rewarding already-delivered work; no verifiable forward application window open at source (page is JS-rendered, no open round confirmed)."
    },
    {
      "name": "Base Builder Grants",
      "source_url": "https://docs.base.org/get-started/get-funded",
      "classification": "NOISE",
      "reason": "Retroactive, discovery-based grants with no formal application or deadline; Base Batches 2026 student-track deadline (Apr 27) also past."
    },
    {
      "name": "XRPL Grants",
      "source_url": "https://xrplgrants.org/",
      "classification": "EXPIRED",
      "reason": "Canonical page states applications are closed; new programming only 'to be announced in Spring 2026' and not yet open."
    },
    {
      "name": "Cosmos / Interchain Foundation (ATOM Accelerator DAO RFPs)",
      "source_url": "https://www.atomaccelerator.com/apply/rfps/",
      "classification": "EXPIRED",
      "reason": "AADAO reports no active RFPs at present."
    },
    {
      "name": "Stellar Community Fund \u2014 SCF #44",
      "source_url": "https://communityfund.stellar.org/awards",
      "classification": "DUPLICATE",
      "reason": "Submission deadline June 14, 2026 already passed and now in Panel Review; superseded by the open SCF #45 round already emitted."
    },
    {
      "name": "Blockchain grant aggregator listicles (rocknblock, hashlock, InnMind, blockchaingrants.org, coinlaunch, AlphaGrowth, GrantedAI)",
      "source_url": "https://rocknblock.io/blog/blockchain-ecosystem-grants-list",
      "classification": "NOISE",
      "reason": "Aggregator/SEO listicles with no single specific newly-opened program to verify; not discovery surfaces."
    }
  ]
}